{
  "$schema": "https://json-schema.org/draft/2020-12/schema",
  "$id": "https://schemas.kumwe.org/studio/v1/canonical-vector.schema.json",
  "title": "Studio canonical serialization vector",
  "description": "One canonical serialization case: a bounded JSON value and either the exact canonical string it serializes to with the digest of its UTF-8 bytes, or the stable reason the canonical form refuses it. Checksums across the contract are computed over exactly these bytes, so an implementation that reproduces this corpus computes the same digests as every other - which is what makes a vendored-corpus check and a stored-document round-trip comparable across languages.",
  "type": "object",
  "additionalProperties": false,
  "required": ["contractVersion", "kind", "id", "description", "value", "expect"],
  "properties": {
    "contractVersion": {
      "$ref": "common.schema.json#/$defs/contractVersion"
    },
    "kind": {
      "const": "canonical-vector"
    },
    "id": {
      "$ref": "common.schema.json#/$defs/stableId"
    },
    "description": {
      "type": "string",
      "minLength": 1,
      "maxLength": 500
    },
    "value": {
      "description": "The input value. Deliberately looser than the canonical JSON value shape so a rejection vector can carry a value the canonical form refuses, such as a forbidden member name. Values the canonical form cannot represent at all - non-finite numbers, undefined - are not expressible in JSON and are proven in implementation tests rather than here."
    },
    "expect": {
      "oneOf": [
        {
          "type": "object",
          "additionalProperties": false,
          "required": ["canonical", "digest"],
          "properties": {
            "canonical": {
              "description": "The exact canonical string, byte for byte.",
              "type": "string",
              "maxLength": 20000
            },
            "digest": {
              "description": "The SRI-style sha256 digest of the canonical UTF-8 bytes.",
              "$ref": "common.schema.json#/$defs/integrity"
            }
          }
        },
        {
          "type": "object",
          "additionalProperties": false,
          "required": ["rejected"],
          "properties": {
            "rejected": {
              "description": "The stable reason the canonical form refuses the value.",
              "enum": ["depth-exceeded", "forbidden-member"]
            }
          }
        }
      ]
    },
    "maximumDepth": {
      "description": "The depth bound to serialize under. Absent means the contract default of 64.",
      "type": "integer",
      "minimum": 1,
      "maximum": 64
    }
  }
}
