{
  "contractVersion": "0.1-draft",
  "kind": "canonical-vector",
  "id": "vector.canonical-vector.numbers",
  "description": "Integers and decimals use the deterministic number grammar.",
  "value": {
    "decimal": 1.5,
    "integer": 42,
    "large": 9007199254740991,
    "negative": -7
  },
  "expect": {
    "canonical": "{\"decimal\":1.5,\"integer\":42,\"large\":9007199254740991,\"negative\":-7}",
    "digest": "sha256-HI1BWhgmbgXvatESL+t+Y1QwYSfvAT4DOaYjU2fmdbQ="
  }
}
