{
  "contractVersion": "0.1-draft",
  "kind": "canonical-vector",
  "id": "vector.canonical-vector.string-escapes",
  "description": "Only the characters ECMA-404 requires are escaped, using the short forms where they exist.",
  "value": {
    "value": "quote\" backslash\\ newline\n tab\t"
  },
  "expect": {
    "canonical": "{\"value\":\"quote\\\" backslash\\\\ newline\\n tab\\t\"}",
    "digest": "sha256-cci0wehH9sStfAleZcirUIOhCgpJKS8jPtKs34gE+ic="
  }
}
