{
  "contractVersion": "0.1-draft",
  "kind": "canonical-vector",
  "id": "vector.canonical-vector.surrogate-pair",
  "description": "An astral character stays one code point in the UTF-8 bytes.",
  "value": {
    "value": "😀"
  },
  "expect": {
    "canonical": "{\"value\":\"😀\"}",
    "digest": "sha256-L8ufbEEor6c96MSNyg/HwfpSDn3KX29eewMH1oMoIMk="
  }
}
