{
  "contractVersion": "0.1-draft",
  "kind": "canonical-vector",
  "id": "vector.canonical-vector.array-order",
  "description": "Arrays keep semantic order; only object members are sorted.",
  "value": {
    "items": ["c", "a", "b"]
  },
  "expect": {
    "canonical": "{\"items\":[\"c\",\"a\",\"b\"]}",
    "digest": "sha256-Skzt0qRLwO/5TqmcmghEQQEADtJ5ASbjphmWAaasB7U="
  }
}
